{
  "$id": "https://raw.githubusercontent.com/davesheffer/hunch/main/contracts/change-proof/hunch.change-proof.v1.schema.json",
  "$schema": "https://json-schema.org/draft/2020-12/schema",
  "type": "object",
  "properties": {
    "schema": { "type": "string", "const": "hunch.change-proof/1" },
    "algorithm": { "type": "string", "const": "hunch-change-proof-sha256/1" },
    "proof_id": { "type": "string", "pattern": "^hproof_[a-f0-9]{24}$" },
    "engine": {
      "type": "object",
      "properties": {
        "package": { "type": "string", "const": "@davesheffer/hunch" },
        "version": { "type": "string", "minLength": 1, "maxLength": 64 }
      },
      "required": ["package", "version"],
      "additionalProperties": false
    },
    "repository": {
      "type": "object",
      "properties": {
        "repository_id": { "type": "string", "pattern": "^pdnar_[a-f0-9]{24}$" },
        "base_revision": { "$ref": "#/$defs/gitObject" },
        "result_revision": { "$ref": "#/$defs/gitObject" }
      },
      "required": ["repository_id", "base_revision", "result_revision"],
      "additionalProperties": false
    },
    "change": {
      "type": "object",
      "properties": {
        "schema": { "type": "string", "const": "hunch.change-identity/1" },
        "algorithm": { "type": "string", "const": "git-raw-tree-delta-sha256/1" },
        "change_id": { "type": "string", "pattern": "^hchg_[a-f0-9]{24}$" },
        "base_revision": { "$ref": "#/$defs/gitObject" },
        "head_revision": { "$ref": "#/$defs/gitObject" },
        "base_tree": { "$ref": "#/$defs/gitObject" },
        "head_tree": { "$ref": "#/$defs/gitObject" },
        "delta_hash": { "$ref": "#/$defs/sha256" },
        "patch_id": { "anyOf": [{ "$ref": "#/$defs/gitObject" }, { "type": "null" }] },
        "file_count": { "type": "integer", "minimum": 1, "maximum": 16384 },
        "paths_hash": { "$ref": "#/$defs/sha256" },
        "content_hash": { "$ref": "#/$defs/sha256" }
      },
      "required": ["schema", "algorithm", "change_id", "base_revision", "head_revision", "base_tree", "head_tree", "delta_hash", "patch_id", "file_count", "paths_hash", "content_hash"],
      "additionalProperties": false
    },
    "project_dna": {
      "type": "object",
      "properties": {
        "schema": { "type": "string", "const": "hunch.project-dna/1" },
        "profile_id": { "type": "string", "pattern": "^pdna_[a-f0-9]{24}$" },
        "repository_id": { "type": "string", "pattern": "^pdnar_[a-f0-9]{24}$" },
        "repository_revision": { "$ref": "#/$defs/gitObject" },
        "content_hash": { "$ref": "#/$defs/sha256" },
        "trait_ids": {
          "type": "array",
          "maxItems": 64,
          "uniqueItems": true,
          "items": { "type": "string", "pattern": "^pdnat_[a-f0-9]{20}$" }
        }
      },
      "required": ["schema", "profile_id", "repository_id", "repository_revision", "content_hash", "trait_ids"],
      "additionalProperties": false
    },
    "graph": {
      "type": "object",
      "properties": {
        "base": { "$ref": "#/$defs/graphSeal" },
        "result": { "$ref": "#/$defs/graphSeal" }
      },
      "required": ["base", "result"],
      "additionalProperties": false
    },
    "changed_files": { "type": "array", "maxItems": 2048, "uniqueItems": true, "items": { "$ref": "#/$defs/repoPath" } },
    "changed_file_count": { "type": "integer", "minimum": 1, "maximum": 16384 },
    "blast_radius": { "type": "array", "maxItems": 4096, "uniqueItems": true, "items": { "$ref": "#/$defs/blastEntry" } },
    "blast_radius_count": { "type": "integer", "minimum": 0, "maximum": 10000000 },
    "decisions": { "type": "array", "maxItems": 1024, "uniqueItems": true, "items": { "$ref": "#/$defs/decisionRef" } },
    "decision_count": { "type": "integer", "minimum": 0, "maximum": 1000000 },
    "constraints": { "type": "array", "maxItems": 1024, "uniqueItems": true, "items": { "$ref": "#/$defs/constraintRef" } },
    "constraint_count": { "type": "integer", "minimum": 0, "maximum": 1000000 },
    "conformance": { "type": "array", "maxItems": 1024, "uniqueItems": true, "items": { "$ref": "#/$defs/conformanceReceipt" } },
    "conformance_count": { "type": "integer", "minimum": 0, "maximum": 1000000 },
    "guard": {
      "type": "object",
      "properties": {
        "verdict": { "type": "string", "enum": ["pass", "fail"] },
        "strict_blocker_ids": { "type": "array", "maxItems": 2048, "uniqueItems": true, "items": { "type": "string", "minLength": 1, "maxLength": 256 } },
        "regression_decision_ids": { "type": "array", "maxItems": 1024, "uniqueItems": true, "items": { "$ref": "#/$defs/decisionId" } },
        "veto_decision_ids": { "type": "array", "maxItems": 1024, "uniqueItems": true, "items": { "$ref": "#/$defs/decisionId" } },
        "report_hash": { "$ref": "#/$defs/sha256" }
      },
      "required": ["verdict", "strict_blocker_ids", "regression_decision_ids", "veto_decision_ids", "report_hash"],
      "additionalProperties": false
    },
    "memory": {
      "type": "object",
      "properties": {
        "scope": { "type": "string", "enum": ["public", "union"] },
        "records_hash": { "$ref": "#/$defs/sha256" }
      },
      "required": ["scope", "records_hash"],
      "additionalProperties": false
    },
    "omissions": { "type": "array", "maxItems": 64, "uniqueItems": true, "items": { "$ref": "#/$defs/hashGap" } },
    "unknowns": { "type": "array", "maxItems": 64, "uniqueItems": true, "items": { "$ref": "#/$defs/hashGap" } },
    "verdict": { "type": "string", "enum": ["fail", "pass", "unknown"] },
    "authority": {
      "type": "object",
      "properties": {
        "execution": { "type": "boolean", "const": false },
        "ci": { "type": "boolean", "const": false },
        "deployment": { "type": "boolean", "const": false },
        "merge": { "type": "boolean", "const": false },
        "ranking": { "type": "boolean", "const": false },
        "promotion": { "type": "boolean", "const": false },
        "policy": { "type": "boolean", "const": false }
      },
      "required": ["execution", "ci", "deployment", "merge", "ranking", "promotion", "policy"],
      "additionalProperties": false
    },
    "content_hash": { "$ref": "#/$defs/sha256" }
  },
  "required": ["schema", "algorithm", "proof_id", "engine", "repository", "change", "project_dna", "graph", "changed_files", "changed_file_count", "blast_radius", "blast_radius_count", "decisions", "decision_count", "constraints", "constraint_count", "conformance", "conformance_count", "guard", "memory", "omissions", "unknowns", "verdict", "authority", "content_hash"],
  "additionalProperties": false,
  "$defs": {
    "gitObject": { "type": "string", "pattern": "^[a-f0-9]{40,64}$" },
    "sha1": { "type": "string", "pattern": "^sha1:[a-f0-9]{40}$" },
    "sha256": { "type": "string", "pattern": "^sha256:[a-f0-9]{64}$" },
    "repoPath": {
      "type": "string",
      "minLength": 1,
      "maxLength": 4096,
      "pattern": "^(?!/)(?![A-Za-z]:)(?!.*\\\\)(?!.*(?:^|/)\\.{1,2}(?:/|$))(?!.*//)[^\\u0000]+$"
    },
    "decisionId": { "type": "string", "pattern": "^dec_[A-Za-z0-9_.-]{3,}$" },
    "constraintId": { "type": "string", "pattern": "^con_[A-Za-z0-9_.-]{3,}$" },
    "graphSeal": {
      "type": "object",
      "properties": {
        "source": { "type": "string", "const": "commit" },
        "revision": { "$ref": "#/$defs/gitObject" },
        "source_hash": { "$ref": "#/$defs/sha1" },
        "topology_hash": { "$ref": "#/$defs/sha256" },
        "files": { "type": "integer", "minimum": 0, "maximum": 1000000 },
        "symbols": { "type": "integer", "minimum": 0, "maximum": 10000000 },
        "edges": { "type": "integer", "minimum": 0, "maximum": 50000000 },
        "components": { "type": "integer", "minimum": 0, "maximum": 1000000 },
        "issue_count": { "type": "integer", "minimum": 0, "maximum": 1000000 }
      },
      "required": ["source", "revision", "source_hash", "topology_hash", "files", "symbols", "edges", "components", "issue_count"],
      "additionalProperties": false
    },
    "blastEntry": {
      "type": "object",
      "properties": {
        "source_path": { "$ref": "#/$defs/repoPath" },
        "dependent_path": { "$ref": "#/$defs/repoPath" },
        "depth": { "type": "integer", "minimum": 1, "maximum": 4 },
        "graphs": { "type": "array", "minItems": 1, "maxItems": 2, "uniqueItems": true, "items": { "type": "string", "enum": ["base", "result"] } }
      },
      "required": ["source_path", "dependent_path", "depth", "graphs"],
      "additionalProperties": false
    },
    "decisionRef": {
      "type": "object",
      "properties": {
        "id": { "$ref": "#/$defs/decisionId" },
        "record_hash": { "$ref": "#/$defs/sha256" },
        "relevance": { "type": "array", "minItems": 1, "maxItems": 4, "uniqueItems": true, "items": { "type": "string", "enum": ["blast_radius", "changed_path", "conformance", "guard"] } },
        "paths": { "type": "array", "maxItems": 128, "uniqueItems": true, "items": { "$ref": "#/$defs/repoPath" } },
        "path_count": { "type": "integer", "minimum": 0, "maximum": 1000000 },
        "paths_hash": { "$ref": "#/$defs/sha256" }
      },
      "required": ["id", "record_hash", "relevance", "paths", "path_count", "paths_hash"],
      "additionalProperties": false
    },
    "constraintRef": {
      "type": "object",
      "properties": {
        "id": { "$ref": "#/$defs/constraintId" },
        "record_hash": { "$ref": "#/$defs/sha256" },
        "severity": { "type": "string", "enum": ["advisory", "warning", "blocking"] },
        "relevance": { "type": "array", "minItems": 1, "maxItems": 2, "uniqueItems": true, "items": { "type": "string", "enum": ["blast_radius", "changed_path"] } },
        "paths": { "type": "array", "maxItems": 128, "uniqueItems": true, "items": { "$ref": "#/$defs/repoPath" } },
        "path_count": { "type": "integer", "minimum": 0, "maximum": 1000000 },
        "paths_hash": { "$ref": "#/$defs/sha256" }
      },
      "required": ["id", "record_hash", "severity", "relevance", "paths", "path_count", "paths_hash"],
      "additionalProperties": false
    },
    "conformanceReceipt": {
      "type": "object",
      "properties": {
        "decision_id": { "$ref": "#/$defs/decisionId" },
        "predicate_index": { "type": "integer", "minimum": 0, "maximum": 1000000 },
        "predicate_hash": { "$ref": "#/$defs/sha256" },
        "satisfied": { "type": "boolean" },
        "detail_hash": { "$ref": "#/$defs/sha256" }
      },
      "required": ["decision_id", "predicate_index", "predicate_hash", "satisfied", "detail_hash"],
      "additionalProperties": false
    },
    "hashGap": {
      "type": "object",
      "properties": {
        "code": { "type": "string", "pattern": "^[a-z][a-z0-9_.-]{2,127}$" },
        "count": { "type": "integer", "minimum": 1, "maximum": 1000000 },
        "evidence_hash": { "$ref": "#/$defs/sha256" }
      },
      "required": ["code", "count", "evidence_hash"],
      "additionalProperties": false
    }
  }
}
